{
  "$schema": "http://json-schema.org/draft-07/schema#",
  "$ref": "#/definitions/SaveBlob",
  "definitions": {
    "SaveBlob": {
      "type": "object",
      "properties": {
        "meta": {
          "$ref": "#/definitions/SaveMeta"
        },
        "world_clock": {
          "$ref": "#/definitions/WorldClock"
        },
        "resources": {
          "type": "object",
          "properties": {
            "Crowns": {
              "$ref": "#/definitions/ResourceBand"
            },
            "Provisions": {
              "$ref": "#/definitions/ResourceBand"
            },
            "Iron": {
              "$ref": "#/definitions/ResourceBand"
            },
            "Aether": {
              "$ref": "#/definitions/ResourceBand"
            }
          },
          "required": [
            "Crowns",
            "Provisions",
            "Iron",
            "Aether"
          ],
          "additionalProperties": false,
          "description": "Safe + exposed per resource incl. Crown exposed (§16); keys are CoreResource ONLY (DC6)."
        },
        "buildings": {
          "$ref": "#/definitions/EmptyListM0",
          "description": "BuildingState/queue records land with the Build Queue feature."
        },
        "workers": {
          "$ref": "#/definitions/EmptyListM0",
          "description": "WorkerState records land with the Economy feature."
        },
        "threat": {
          "$ref": "#/definitions/ThreatBlock"
        },
        "claim_ledger": {
          "$ref": "#/definitions/ClaimLedgerState",
          "description": "Claim Ledger block (Save/Load §16: packages + story claims + remainders) — real shape since A2 (v2)."
        },
        "pending_reward_resolution": {
          "type": "array",
          "items": {
            "$ref": "#/definitions/PendingRewardResolution"
          },
          "description": "Persistent pending_reward_resolution records (Doc 04 §10; Save/Load §11; D19/L14) — real shape since A2 (v2)."
        },
        "events": {
          "type": "array",
          "items": {
            "$ref": "#/definitions/EventInstance"
          },
          "description": "Mid-flight event-lifecycle instances (Doc 15 §2; EVT3) — real shape since A3 (v3). Inert staged effects only; no effect execution exists."
        },
        "system_messages": {
          "$ref": "#/definitions/EmptyListM0",
          "description": "system_message records (Save/Load §12, M8)."
        },
        "merit": {
          "$ref": "#/definitions/EmptyMapM0",
          "description": "Per-faction Merit standing (soulbound; never in 3S bands — DC6/FCT1)."
        },
        "guardian_bond": {
          "type": "null",
          "description": "Persistent guardian bond state (GDN10); null until the guardian feature lands."
        },
        "flags_story": {
          "$ref": "#/definitions/EmptyMapM0",
          "description": "Story/flag state (§16 \"flags/story\")."
        }
      },
      "required": [
        "meta",
        "world_clock",
        "resources",
        "buildings",
        "workers",
        "threat",
        "claim_ledger",
        "pending_reward_resolution",
        "events",
        "system_messages",
        "merit",
        "guardian_bond",
        "flags_story"
      ],
      "additionalProperties": false,
      "description": "The complete save blob (Save/Load §16). Field order here is documentation only — serialization is canonical (sorted keys) so round-trips are byte-identical regardless of construction order."
    },
    "SaveMeta": {
      "type": "object",
      "properties": {
        "save_schema_version": {
          "type": "number"
        },
        "game_version": {
          "type": "string"
        },
        "last_saved_utc": {
          "type": "string",
          "description": "ISO-8601 UTC (§2); reconciliation uses UTC deltas only (§3)."
        }
      },
      "required": [
        "save_schema_version",
        "game_version",
        "last_saved_utc"
      ],
      "additionalProperties": false,
      "description": "Save/Load §1/§2: versions + absolute UTC timestamp (ISO-8601)."
    },
    "WorldClock": {
      "type": "object",
      "properties": {
        "day_index": {
          "type": "number"
        },
        "time_of_day": {
          "type": "number"
        }
      },
      "required": [
        "day_index",
        "time_of_day"
      ],
      "additionalProperties": false,
      "description": "In-game World Clock (§2: \"day index, time-of-day\"). `time_of_day` is an integer pulse counter within the day; its cadence binds to the Economy pulse when the sim core lands (E8 pacing is UNKNOWN until measured)."
    },
    "ResourceBand": {
      "type": "object",
      "properties": {
        "safe": {
          "type": "number"
        },
        "exposed": {
          "type": "number"
        }
      },
      "required": [
        "safe",
        "exposed"
      ],
      "additionalProperties": false,
      "description": "Per-resource stored state: Safe S + Exposed 2S bands (D1). These are state values; the S/2S/3S caps themselves are /data seed values (DC1), not save fields."
    },
    "EmptyListM0": {
      "type": "array",
      "minItems": 0,
      "maxItems": 0,
      "description": "M0 empty-shell placeholder: schema-enforced empty list until the block's feature + migration land."
    },
    "ThreatBlock": {
      "type": "object",
      "properties": {
        "phase": {
          "$ref": "#/definitions/RaidPhase"
        }
      },
      "required": [
        "phase"
      ],
      "additionalProperties": false,
      "description": "Threat block, minimal at M0: phase only (Doc 05; components land with the threat director)."
    },
    "RaidPhase": {
      "type": "string",
      "enum": [
        "calm",
        "watch",
        "warning",
        "assault",
        "aftermath"
      ],
      "description": "Threat/raid phase vocabulary (Doc 07 §2; Doc 05 phase order). The empty world's zero-state is \"calm\"; an Assault never auto-resolves offline (D7)."
    },
    "ClaimLedgerState": {
      "type": "object",
      "properties": {
        "packages": {
          "type": "array",
          "items": {
            "$ref": "#/definitions/LedgerPackage"
          }
        },
        "story_claims": {
          "type": "array",
          "items": {
            "$ref": "#/definitions/StoryClaim"
          }
        }
      },
      "required": [
        "packages",
        "story_claims"
      ],
      "additionalProperties": false,
      "description": "The Claim Ledger save/sim state (Save/Load §16 `claim_ledger` block: \"packages, story claims, remainders\" — remainders live inside packages)."
    },
    "LedgerPackage": {
      "type": "object",
      "properties": {
        "package_id": {
          "type": "string"
        },
        "source_type": {
          "$ref": "#/definitions/RewardSourceType"
        },
        "contents": {
          "$ref": "#/definitions/RewardPackageContents"
        },
        "created_world_clock": {
          "$ref": "#/definitions/WorldClock"
        },
        "is_story": {
          "type": "boolean",
          "const": false,
          "description": "Ledger packages are non-story by construction; Story Claims live in their own protected list."
        },
        "system_grant": {
          "type": "boolean",
          "const": false,
          "description": "D13/L13: no system-grant path exists at A2 (literal false until the guarded feature lands)."
        },
        "held_remainder": {
          "$ref": "#/definitions/RewardResources"
        }
      },
      "required": [
        "package_id",
        "source_type",
        "contents",
        "created_world_clock",
        "is_story",
        "system_grant",
        "held_remainder"
      ],
      "additionalProperties": false,
      "description": "One held (earned-but-unclaimed) reward package in the Claim Ledger (Doc 04 §13; Save/Load §10; Doc 07 §3 `claim_package`).\n\n`contents` is the original as-routed package (immutable record of what was earned); `held_remainder` is what remains unclaimed — entries are strictly positive and never exceed their `contents` counterpart, so at any moment `claimed-so-far == contents − held_remainder` and every partial claim satisfies `claimed + held_remainder == original` (L6). A package with an empty held_remainder is fully claimed and leaves the Ledger."
    },
    "RewardSourceType": {
      "type": "string",
      "const": "test_supplied",
      "description": "The only reward source that exists at A2: test-supplied packages driven by the harness/tests. Gameplay sources (Doc 04 §2) widen this union via migration when their features are authorized and implemented."
    },
    "RewardPackageContents": {
      "type": "object",
      "properties": {
        "resources": {
          "$ref": "#/definitions/RewardResources"
        },
        "flags": {
          "$ref": "#/definitions/EmptyRewardListA2"
        },
        "cosmetics": {
          "$ref": "#/definitions/EmptyRewardListA2"
        },
        "gear_refs": {
          "$ref": "#/definitions/EmptyRewardListA2"
        }
      },
      "required": [
        "resources",
        "flags",
        "cosmetics",
        "gear_refs"
      ],
      "additionalProperties": false,
      "description": "Reward package contents (Doc 04 §4 / §13 `contents`). At A2 only the resource portion is real; flags/cosmetics/gear_refs are schema-enforced empty (FUTURE BUILD — Doc 04 §4, Doc 09)."
    },
    "RewardResources": {
      "type": "object",
      "properties": {
        "Crowns": {
          "type": "number"
        },
        "Provisions": {
          "type": "number"
        },
        "Iron": {
          "type": "number"
        },
        "Aether": {
          "type": "number"
        }
      },
      "additionalProperties": false,
      "description": "Per-CoreResource reward amounts. Partial map — only resources actually present carry entries; the generated schema rejects any non-CoreResource key (Merit/XP/BondXP/BondCharge can never be packaged — Doc 04 §3, D26)."
    },
    "EmptyRewardListA2": {
      "type": "array",
      "minItems": 0,
      "maxItems": 0,
      "description": "A2 empty-block placeholder (M0 pattern): schema-enforced empty until the feature + migration land."
    },
    "StoryClaim": {
      "type": "object",
      "properties": {
        "claim_id": {
          "type": "string"
        },
        "source_type": {
          "$ref": "#/definitions/RewardSourceType"
        },
        "contents": {
          "$ref": "#/definitions/RewardPackageContents"
        },
        "created_world_clock": {
          "$ref": "#/definitions/WorldClock"
        },
        "is_story": {
          "type": "boolean",
          "const": true
        }
      },
      "required": [
        "claim_id",
        "source_type",
        "contents",
        "created_world_clock",
        "is_story"
      ],
      "additionalProperties": false,
      "description": "One protected Story Claim (Doc 04 §6/§11, D15): non-expiring, never deleted, never counts against slot caps. At A2 this is a structural placeholder — Story Claims are created by routing and preserved forever; claiming their resource portion into the Harbor is FUTURE BUILD (no gameplay story source exists to feed them)."
    },
    "PendingRewardResolution": {
      "type": "object",
      "properties": {
        "pending_id": {
          "type": "string"
        },
        "source_type": {
          "$ref": "#/definitions/RewardSourceType"
        },
        "source_event_id": {
          "type": "string"
        },
        "generated_reward_seed": {
          "type": "number"
        },
        "package_contents": {
          "$ref": "#/definitions/RewardPackageContents"
        },
        "created_world_clock": {
          "$ref": "#/definitions/WorldClock"
        },
        "blocking_reason": {
          "type": "string",
          "description": "Deterministic description of the blocking slot(s), e.g. \"per_resource_cap:Crowns\" or \"global_cap\" (Doc 04 §10.6 \"naming the blocking slot\")."
        },
        "allowed_resolution_actions": {
          "type": "array",
          "items": {
            "$ref": "#/definitions/PendingResolutionAction"
          }
        },
        "related_system_message_id": {
          "type": "null",
          "description": "Literal null until the System Inbox exists (Doc 04A FUTURE BUILD); becomes a message link via migration (M2/M3/DC3)."
        }
      },
      "required": [
        "pending_id",
        "source_type",
        "source_event_id",
        "generated_reward_seed",
        "package_contents",
        "created_world_clock",
        "blocking_reason",
        "allowed_resolution_actions",
        "related_system_message_id"
      ],
      "additionalProperties": false,
      "description": "One persistent pending reward (Doc 04 §10; Save/Load §11; Doc 07 §3; D14/D19/L11/L14): a non-story package that could not enter the Claim Ledger because a slot cap was full. Not in the Ledger, not spendable, never silently deleted, never duplicated by reload. At A2 `pending_id` is the blocked package's `package_id` (1:1, globally unique), preserving exact identity through block → resolve."
    },
    "PendingResolutionAction": {
      "type": "string",
      "const": "deliver_to_ledger",
      "description": "The only pending-resolution action implemented at A2: re-deliver the package into the Claim Ledger once slot capacity frees. Doc 04 §10.3's further actions (direct claim, split, convert) are FUTURE BUILD and schema-rejected until implemented."
    },
    "EventInstance": {
      "type": "object",
      "properties": {
        "instance_id": {
          "type": "string"
        },
        "event_id": {
          "type": "string",
          "description": "Stable identity of the defining Event; never changes across transitions (EVT2)."
        },
        "state": {
          "$ref": "#/definitions/EventLifecycleState"
        },
        "selected_outcome_id": {
          "type": [
            "string",
            "null"
          ],
          "description": "Set exactly once at ACTIVE → RESOLVING; null before that."
        },
        "staged_effects": {
          "type": "array",
          "items": {
            "$ref": "#/definitions/Effect"
          }
        }
      },
      "required": [
        "instance_id",
        "event_id",
        "state",
        "selected_outcome_id",
        "staged_effects"
      ],
      "additionalProperties": false,
      "description": "One in-flight event's persistent state — the shape that lives in the SaveBlob `events` block (v3) so EVT3's save-atomicity claim is about the REAL save path, not a side file. `staged_effects` are inert copies made at ACTIVE → RESOLVING and preserved verbatim through RESOLVING → RESOLVED and across save/load: never executed, never duplicated, never dropped."
    },
    "EventLifecycleState": {
      "type": "string",
      "enum": [
        "DORMANT",
        "ELIGIBLE",
        "OFFERED",
        "TRIGGERED",
        "ACTIVE",
        "RESOLVING",
        "RESOLVED",
        "EXPIRED",
        "DECLINED"
      ],
      "description": "Lifecycle state labels (Doc 15 §2; A3 brief §1.3). OFFERED and TRIGGERED are mutually exclusive paths — player-choice events offer, imposed events trigger; the slash notation in Doc 15's diagram expresses alternatives, never a literal combined state. RESOLVED, EXPIRED, and DECLINED are terminal."
    },
    "Effect": {
      "type": "object",
      "properties": {
        "effect_id": {
          "type": "string"
        },
        "binds_to": {
          "$ref": "#/definitions/EffectBinding"
        }
      },
      "required": [
        "effect_id",
        "binds_to"
      ],
      "additionalProperties": false,
      "description": "Inert effect descriptor (Doc 15 §4): names the existing system it would route through. Carries NO amounts, NO payload, NO execution path — it is staged and preserved by the lifecycle, never applied (A3 brief §2)."
    },
    "EffectBinding": {
      "type": "string",
      "enum": [
        "claim_ledger",
        "ship_hold_docked_cargo",
        "threat_director",
        "economy_modifier",
        "faction_standing",
        "harbor_inbox",
        "guardian_reaction"
      ],
      "description": "The existing system an effect WOULD bind to (Doc 15 §4 table). Pure reference vocabulary at A3: no dispatch to any of these systems exists, and the lifecycle never interprets this field (EVT5/EVT6 fail-loud)."
    },
    "EmptyMapM0": {
      "type": "object",
      "additionalProperties": {
        "not": {}
      },
      "description": "M0 empty-shell placeholder: schema-enforced empty map until the block's feature + migration land."
    }
  },
  "$id": "hg.save_blob",
  "$comment": "GENERATED from src/contracts/save-blob.ts (D39) — do not edit by hand; run `pnpm run schema:generate`."
}
